{
  "manifest_type": "artifact_verification_manifest",
  "artifact_id": "math-node-v0.1-classification-supersession",
  "version": "1.0.0",
  "artifacts": [
    {
      "path": "manifests/math-node-v0.1-replay.json",
      "sha256": "effb92008a760ae228803a427a146bec1b8cee8df1c764ac9c48f16c85b0b8c9",
      "schema": null
    },
    {
      "path": "projects/math-node/evidence/math-node-v0.1-replay.json",
      "sha256": "effb92008a760ae228803a427a146bec1b8cee8df1c764ac9c48f16c85b0b8c9",
      "schema": null
    }
  ],
  "expected_checks": [
    "historical source and evidence copy are byte-identical",
    "historical digest inventory remains available for artifact verification",
    "no executable replay command is asserted",
    "classification supersession links to the preserved historical source"
  ],
  "provenance": {
    "record_type": "provenance_record",
    "artifact_id": "math-node-v0.1-classification-supersession",
    "input_hash": "effb92008a760ae228803a427a146bec1b8cee8df1c764ac9c48f16c85b0b8c9",
    "output_hash": "effb92008a760ae228803a427a146bec1b8cee8df1c764ac9c48f16c85b0b8c9",
    "validator_result": "PASS",
    "owner": "harness",
    "created_at": "2026-09-07T00:00:00Z",
    "source_conversation_id": null,
    "source_note": "Supersedes only the legacy replay classification. Source: manifests/math-node-v0.1-replay.json. No executable command or current execution claim is present.",
    "validation_errors": [],
    "diagnostic_reasons": []
  }
}
